{
  "abstract_steps": [
    "init_resource",
    "escape",
    "free",
    "fetch",
    "use",
    "cleanup"
  ],
  "arch": "arm64",
  "candidate_id": "cand_59fda0076e3243f2",
  "confidence": {
    "mapping_confidence": "manual",
    "ready_for_smt": true,
    "supported": true,
    "unsupported_reasons": [
      "heuristic predicate preserved: kvm_vcpu_fd_ready",
      "heuristic predicate preserved: kvm_vm_fd_ready"
    ]
  },
  "debug": {
    "loc0": {
      "context": [
        "kvm_vcpu_release",
        "kvm_timer_vcpu_terminate",
        "destroy_hrtimer"
      ],
      "file": "arch/arm64/kvm/arch_timer.c",
      "function": "kvm_timer_vcpu_terminate",
      "line": 812
    },
    "loc1": {
      "context": [
        "kvm_vcpu_ioctl",
        "kvm_timer_flush_hwstate",
        "kvm_timer_should_fire"
      ],
      "file": "arch/arm64/kvm/arch_timer.c",
      "function": "kvm_timer_should_fire",
      "line": 923
    },
    "notes": [
      "Structural seed intent only: preserves setup chain, ordering, predicates, and concurrency hints.",
      "Exact KVM argument synthesis remains intentionally out of scope for mock_seed/v1."
    ],
    "same_object": true,
    "selected_entry_func": "kvm_vcpu_ioctl",
    "selected_entry_kind": "file_ioctl",
    "selected_template_id": "kvm_vcpu_ioctl:file_ioctl:kvm-arm64:regs:v1"
  },
  "entries": [
    {
      "confidence": "grounded",
      "entry_func": "kvm_vcpu_ioctl",
      "entry_kind": "file_ioctl",
      "notes": [
        "mapping_source=manual"
      ],
      "support_level": "grounded",
      "supported": true,
      "template_ids": [
        "kvm_vcpu_ioctl:file_ioctl:kvm-arm64:regs:v1",
        "kvm_vcpu_ioctl:file_ioctl:kvm-arm64:v2"
      ]
    },
    {
      "confidence": "grounded",
      "entry_func": "kvm_vm_ioctl_create_vcpu",
      "entry_kind": "file_ioctl",
      "notes": [
        "mapping_source=manual"
      ],
      "support_level": "grounded",
      "supported": true,
      "template_ids": [
        "kvm_vm_ioctl_create_vcpu:file_ioctl:kvm-arm64:v1"
      ]
    }
  ],
  "flow": "Con",
  "focus_syscall_families": [
    "openat$KVM",
    "KVM_CREATE_VM",
    "KVM_CREATE_VCPU",
    "KVM_ARM_VCPU_INIT",
    "KVM_SET_ONE_REG",
    "KVM_GET_ONE_REG",
    "KVM_RUN",
    "KVM_CREATE_DEVICE",
    "KVM_SET_DEVICE_ATTR",
    "KVM_IRQ_LINE"
  ],
  "mutation_hints": {
    "focus_syscall_families": [
      "openat$KVM",
      "KVM_CREATE_VM",
      "KVM_CREATE_VCPU",
      "KVM_ARM_VCPU_INIT",
      "KVM_SET_ONE_REG",
      "KVM_GET_ONE_REG",
      "KVM_RUN",
      "KVM_CREATE_DEVICE",
      "KVM_SET_DEVICE_ATTR",
      "KVM_IRQ_LINE"
    ],
    "keep_ordering_edges": [
      "escape->fetch",
      "escape->fetch",
      "free->use",
      "free->use"
    ],
    "mutate_near_steps": [
      "fetch",
      "use"
    ],
    "prefer_collide": true,
    "prefer_two_thread_schedule": true,
    "preserve_prefix_len": 3,
    "stable_prefix_resources": [
      "/dev/kvm",
      "fd_kvm",
      "fd_vm",
      "fd_vcpu"
    ]
  },
  "ordered_steps": [
    {
      "event": "free",
      "step_index": 0,
      "thread_id": 0,
      "timestamp": 0
    },
    {
      "event": "use",
      "step_index": 1,
      "thread_id": 1,
      "timestamp": 1
    },
    {
      "event": "escape",
      "step_index": 2,
      "thread_id": 0,
      "timestamp": 2
    },
    {
      "event": "cleanup",
      "step_index": 3,
      "thread_id": 0,
      "timestamp": 3
    },
    {
      "event": "fetch",
      "step_index": 4,
      "thread_id": 0,
      "timestamp": 4
    },
    {
      "event": "init_resource",
      "step_index": 5,
      "thread_id": 0,
      "timestamp": 5
    }
  ],
  "ordering": [
    {
      "after": "fetch",
      "before": "escape",
      "reason": "Pointer must escape before later fetch/use chain."
    },
    {
      "after": "fetch",
      "before": "escape",
      "reason": "VCPU timer context must be installed before it can be fetched from ioctl-side logic."
    },
    {
      "after": "use",
      "before": "free",
      "reason": "Cross-entry UAF requires timer teardown to occur before later timer use."
    },
    {
      "after": "use",
      "before": "free",
      "reason": "Use-after-free requires free to occur before use."
    }
  ],
  "predicates": [
    {
      "grounding": "grounded",
      "must_hold_at": "init_resource",
      "name": "kvm_fd_ready"
    },
    {
      "grounding": "heuristic",
      "must_hold_at": "fetch",
      "name": "kvm_vcpu_fd_ready"
    },
    {
      "grounding": "heuristic",
      "must_hold_at": "escape",
      "name": "kvm_vm_fd_ready"
    }
  ],
  "resource_dependencies": [
    "/dev/kvm",
    "fd_kvm",
    "fd_vm",
    "fd_vcpu"
  ],
  "seed_version": "mock_seed/v1",
  "setup_sequence": [
    {
      "family": "openat$KVM",
      "grounding": "grounded",
      "kind": "syscall",
      "resource_effect": "fd_kvm",
      "stage": "setup",
      "text": "openat$KVM(AT_FDCWD, '/dev/kvm', O_RDWR)"
    },
    {
      "family": "KVM_CREATE_VM",
      "grounding": "grounded",
      "kind": "syscall",
      "resource_effect": "fd_vm",
      "stage": "setup",
      "text": "ioctl$KVM_CREATE_VM(fd_kvm, KVM_CREATE_VM, 0)"
    },
    {
      "family": "KVM_CREATE_VCPU",
      "grounding": "grounded",
      "kind": "syscall",
      "resource_effect": "fd_vcpu",
      "stage": "setup",
      "text": "ioctl$KVM_CREATE_VCPU(fd_vm, KVM_CREATE_VCPU, 0)"
    }
  ],
  "source": {
    "normalizer": "extractor.import_uafx_bridge_export",
    "producer": "uaf-bridge",
    "uafx_warning_id": "uafx-kvm-arm64-0001",
    "witness_plan_status": "sat"
  },
  "subsystem": "kvm",
  "target": "linux",
  "thread_hints": {
    "prefer_collide": true,
    "schedule_style": "two-thread-collision",
    "thread_step_counts": [
      {
        "step_count": 5,
        "thread_id": 0
      },
      {
        "step_count": 1,
        "thread_id": 1
      }
    ]
  },
  "threads": 2,
  "trigger_sequence": [
    {
      "family": "KVM_ARM_VCPU_INIT",
      "grounding": "grounded",
      "kind": "syscall",
      "resource_effect": null,
      "stage": "trigger",
      "text": "ioctl$KVM_ARM_VCPU_INIT(fd_vcpu, KVM_ARM_VCPU_INIT, &init)"
    },
    {
      "family": "KVM_SET_ONE_REG",
      "grounding": "grounded",
      "kind": "syscall",
      "resource_effect": null,
      "stage": "trigger",
      "text": "ioctl$KVM_SET_ONE_REG(fd_vcpu, KVM_SET_ONE_REG, &one_reg)"
    },
    {
      "family": "KVM_GET_ONE_REG",
      "grounding": "grounded",
      "kind": "syscall",
      "resource_effect": null,
      "stage": "trigger",
      "text": "ioctl$KVM_GET_ONE_REG(fd_vcpu, KVM_GET_ONE_REG, &one_reg)"
    },
    {
      "family": "KVM_RUN",
      "grounding": "grounded",
      "kind": "syscall",
      "resource_effect": null,
      "stage": "trigger",
      "text": "ioctl$KVM_RUN(fd_vcpu, KVM_RUN, 0)"
    },
    {
      "family": "KVM_ARM_VCPU_INIT",
      "grounding": "heuristic",
      "kind": "syscall",
      "resource_effect": null,
      "stage": "trigger",
      "text": "ioctl$KVM_ARM_VCPU_INIT(fd_vcpu, KVM_ARM_VCPU_INIT, &init)"
    },
    {
      "family": "KVM_RUN",
      "grounding": "heuristic",
      "kind": "syscall",
      "resource_effect": null,
      "stage": "trigger",
      "text": "ioctl$KVM_RUN(fd_vcpu, KVM_RUN, 0)"
    }
  ]
}
